[
  {
    "id": "aaaaaaaa-aaaa-4aaa-8aaa-aaaaaaaaaaa1",
    "company": "Medtronic",
    "title": "University internships",
    "apply_url": "https://example.com/medtronic",
    "season": "summer-2027",
    "role_family": "Other STEM",
    "location": "Minneapolis, MN",
    "degree": "unspecified",
    "row_kind": "program_fallback",
    "source": "seed",
    "first_seen": "2026-08-14",
    "last_seen": "2026-08-14"
  },
  {
    "id": "aaaaaaaa-aaaa-4aaa-8aaa-aaaaaaaaaaa2",
    "company": "Intuitive",
    "title": "Student internships",
    "apply_url": "https://example.com/intuitive",
    "season": "summer-2027",
    "role_family": "Other STEM",
    "location": "Sunnyvale, CA",
    "degree": "unspecified",
    "row_kind": "program_fallback",
    "source": "seed",
    "first_seen": "2026-08-14",
    "last_seen": "2026-08-14"
  },
  {
    "id": "aaaaaaaa-aaaa-4aaa-8aaa-aaaaaaaaaaa3",
    "company": "Abbott",
    "title": "University Internship Program",
    "apply_url": "https://example.com/abbott",
    "season": "summer-2027",
    "role_family": "Other STEM",
    "location": "Abbott Park, IL",
    "degree": "unspecified",
    "row_kind": "program_fallback",
    "source": "seed",
    "first_seen": "2026-08-14",
    "last_seen": "2026-08-14"
  },
  {
    "id": "aaaaaaaa-aaaa-4aaa-8aaa-aaaaaaaaaaa4",
    "company": "Dexcom",
    "title": "Summer Internship Program",
    "apply_url": "https://example.com/dexcom",
    "season": "summer-2027",
    "role_family": "Other STEM",
    "location": "San Diego, CA",
    "degree": "unspecified",
    "row_kind": "program_fallback",
    "source": "seed",
    "first_seen": "2026-08-14",
    "last_seen": "2026-08-14"
  },
  {
    "id": "aaaaaaaa-aaaa-4aaa-8aaa-aaaaaaaaaaa5",
    "company": "Insulet",
    "title": "Student opportunities",
    "apply_url": "https://example.com/insulet",
    "season": "summer-2027",
    "role_family": "Other STEM",
    "location": "Acton, MA",
    "degree": "unspecified",
    "row_kind": "program_fallback",
    "source": "seed",
    "first_seen": "2026-08-14",
    "last_seen": "2026-08-14"
  },
  {
    "id": "aaaaaaaa-aaaa-4aaa-8aaa-aaaaaaaaaaa6",
    "company": "Tandem",
    "title": "Internship Program",
    "apply_url": "https://example.com/tandem",
    "season": "summer-2027",
    "role_family": "Other STEM",
    "location": "San Diego, CA",
    "degree": "unspecified",
    "row_kind": "program_fallback",
    "source": "seed",
    "first_seen": "2026-08-14",
    "last_seen": "2026-08-14"
  },
  {
    "id": "aaaaaaaa-aaaa-4aaa-8aaa-aaaaaaaaaaa7",
    "company": "Stryker",
    "title": "Students and graduates internships",
    "apply_url": "https://example.com/stryker",
    "season": "summer-2027",
    "role_family": "Other STEM",
    "location": "Portage, MI",
    "degree": "unspecified",
    "row_kind": "program_fallback",
    "source": "seed",
    "first_seen": "2026-08-14",
    "last_seen": "2026-08-14"
  },
  {
    "id": "aaaaaaaa-aaaa-4aaa-8aaa-aaaaaaaaaaa8",
    "company": "Boston Scientific",
    "title": "Students and early careers",
    "apply_url": "https://example.com/boston-scientific",
    "season": "summer-2027",
    "role_family": "Other STEM",
    "location": "Marlborough, MA",
    "degree": "unspecified",
    "row_kind": "program_fallback",
    "source": "seed",
    "first_seen": "2026-08-14",
    "last_seen": "2026-08-14"
  },
  {
    "id": "aaaaaaaa-aaaa-4aaa-8aaa-aaaaaaaaaaa9",
    "company": "Edwards",
    "title": "Summer Internship Program",
    "apply_url": "https://example.com/edwards",
    "season": "summer-2027",
    "role_family": "Other STEM",
    "location": "Irvine, CA",
    "degree": "unspecified",
    "row_kind": "program_fallback",
    "source": "seed",
    "first_seen": "2026-08-14",
    "last_seen": "2026-08-14"
  },
  {
    "id": "aaaaaaaa-aaaa-4aaa-8aaa-aaaaaaaaaa10",
    "company": "BD",
    "title": "Early Talent internships",
    "apply_url": "https://example.com/bd",
    "season": "summer-2027",
    "role_family": "Other STEM",
    "location": "Franklin Lakes, NJ",
    "degree": "unspecified",
    "row_kind": "program_fallback",
    "source": "seed",
    "first_seen": "2026-08-14",
    "last_seen": "2026-08-14"
  },
  {
    "id": "aaaaaaaa-aaaa-4aaa-8aaa-aaaaaaaaaa11",
    "company": "Zimmer Biomet",
    "title": "Internships and early career programs",
    "apply_url": "https://example.com/zimmer-biomet",
    "season": "summer-2027",
    "role_family": "Other STEM",
    "location": "Warsaw, IN",
    "degree": "unspecified",
    "row_kind": "program_fallback",
    "source": "seed",
    "first_seen": "2026-08-14",
    "last_seen": "2026-08-14"
  },
  {
    "id": "aaaaaaaa-aaaa-4aaa-8aaa-aaaaaaaaaa12",
    "company": "GE HealthCare",
    "title": "Internships",
    "apply_url": "https://example.com/ge-healthcare",
    "season": "summer-2027",
    "role_family": "Other STEM",
    "location": "Chicago, IL",
    "degree": "unspecified",
    "row_kind": "program_fallback",
    "source": "seed",
    "first_seen": "2026-08-14",
    "last_seen": "2026-08-14"
  }
]
